{
  "version": 1,
  "source": {
    "repoName": "csv-stats",
    "contextPath": "CLAUDE.md",
    "contextHash": "sha256:3cad0351b53784a76f0b9690f5375c5a0dc5b368a85a48746a74996a43aeea7e"
  },
  "extraction": {
    "model": "claude-opus-4-7",
    "promptVersion": 2,
    "anchorFallbacks": 0,
    "generatedAt": "2026-05-10T22:28:49Z"
  },
  "instructions": [
    {
      "id": "instr-d177f6a3",
      "title": "Project layout overview",
      "snippet": "This is the csv-stats package, a small Python utility that summarizes CSV files into JSON reports. The library lives under `src/csvstats/`, tests under `tests/`, and the CLI entry point is `csvstats`.",
      "sourceFile": "CLAUDE.md",
      "startOffset": 13,
      "endOffset": 213
    },
    {
      "id": "instr-40424d2c",
      "title": "Type hints and formatting",
      "snippet": "Use type hints on every public function signature and prefer `pathlib.Path` over `os.path` for filesystem work. Run `ruff check` before committing; nothing should merge that hasn't been formatted.",
      "sourceFile": "CLAUDE.md",
      "startOffset": 215,
      "endOffset": 411
    },
    {
      "id": "instr-dd63c11a",
      "title": "Keep patches narrow and focused",
      "snippet": "Before changing code, read the files directly relevant to the request and keep the patch as narrow as possible. Prefer the obvious fix over a generalized abstraction, and do not introduce new dependencies unless the reason is clear from the diff. If the change touches shared behavior in `src/csvstats/`, add or update a focused test.",
      "sourceFile": "CLAUDE.md",
      "startOffset": 413,
      "endOffset": 747
    },
    {
      "id": "instr-e7179979",
      "title": "Testing conventions",
      "snippet": "Tests live under `tests/` and use pytest. Run `pytest -q` from the repo root, and add at least one test for any new public function in `src/csvstats/` -- fixtures under `tests/fixtures/` cover the common shapes, so reach for those before inventing new inputs, and lean on property-based tests around the numeric summarizers since rounding edges are easy to miss.",
      "sourceFile": "CLAUDE.md",
      "startOffset": 749,
      "endOffset": 1111
    },
    {
      "id": "instr-cf4c5f0a",
      "title": "Logging and secret handling",
      "snippet": "Logging goes through the standard library `logging` module everywhere; library code must never call `print` directly, since `print` is reserved for CLI stdout output. When catching and logging an exception, use ERROR level with `exc_info=True` so the traceback is preserved. Separately, never log API keys, tokens, or user PII, and redact secrets out of any error message before it reaches a handler.",
      "sourceFile": "CLAUDE.md",
      "startOffset": 1113,
      "endOffset": 1513
    },
    {
      "id": "instr-8ab40701",
      "title": "Admin web UI styling",
      "snippet": "For the optional admin web UI, prefer Tailwind utility classes for layout and CSS modules for component-scoped styles. Interactive elements must preserve aria state, visible focus rings, and non-color-only status cues.",
      "sourceFile": "CLAUDE.md",
      "startOffset": 1515,
      "endOffset": 1733
    },
    {
      "id": "instr-35a85015",
      "title": "Domain-specific exceptions",
      "snippet": "Error paths in loader and report functions should raise domain-specific exceptions from `csvstats.errors` rather than letting raw `csv.Error` or `FileNotFoundError` propagate unhandled. Wrap third-party exceptions at the module boundary so callers can catch a single hierarchy.",
      "sourceFile": "CLAUDE.md",
      "startOffset": 1735,
      "endOffset": 2012
    },
    {
      "id": "instr-2973b9bf",
      "title": "Deploy via Jenkins pipeline",
      "snippet": "Deploy via the legacy Jenkins pipeline at `ci.internal/csv-stats` -- manually edit `deploy/values.yaml`, bump the chart version, and trigger the job from the dashboard.",
      "sourceFile": "CLAUDE.md",
      "startOffset": 2014,
      "endOffset": 2182
    },
    {
      "id": "instr-8a9f6c8f",
      "title": "Version bumps and tagging",
      "snippet": "Bump `version` in `pyproject.toml` for any change that alters public behavior; tags are cut from main automatically by `.github/workflows/deploy.yml` once the wheel publishes, so do not push tags by hand.",
      "sourceFile": "CLAUDE.md",
      "startOffset": 2184,
      "endOffset": 2388
    }
  ]
}
